,occupation,organization,title,link,datePosted
0,"Drifttekniker, data",Framtiden i Sverige AB,2nd line drifttekniker sökes till stort IT-konsult bolag!,https://arbetsformedlingen.se/platsbanken/annonser/26711453,2022-10-26
1,Systemutvecklare/Programmerare,Experis AB,Bästa Utvecklare i Örebro,https://arbetsformedlingen.se/platsbanken/annonser/26222171,2022-06-16
2,IT-tekniker/Datatekniker,Epiroc Rock Drills AB,Data Engineer,https://arbetsformedlingen.se/platsbanken/annonser/26740496,2022-11-01
3,Lagerarbetare,Svenska Storesupport Bemanning AB,Extrajobb som lagermedarbetare på KGA Logistik - Örebro,https://arbetsformedlingen.se/platsbanken/annonser/26633844,2022-10-07
4,Lagerarbetare,Best Bemanning & Rekrytering i Sverige AB,Extrapersonal Plock & Pack,https://arbetsformedlingen.se/platsbanken/annonser/26729578,2022-10-31
5,Systemutvecklare/Programmerare,Alten Sverige AB,Fullstack  .NET utvecklare,https://arbetsformedlingen.se/platsbanken/annonser/26743655,2022-11-02
6,IT-strateg,Försvarsmakten,IT specialist Microsoft Windows och mobilitet,https://arbetsformedlingen.se/platsbanken/annonser/26630919,2022-10-06
7,IT-strateg,Randstad AB,IT-specialist inom datacenter och server till Örebro kommun,https://arbetsformedlingen.se/platsbanken/annonser/26717116,2022-10-27
8,Dataingenjör,Academic Work Sweden AB,IT-student till Anderssons Byggnadsekonomi,https://arbetsformedlingen.se/platsbanken/annonser/26732261,2022-10-31
9,IT-tekniker/Datatekniker,REGION ÖREBRO LÄN,Infrastrukturspecialist inom Backup och Windows,https://arbetsformedlingen.se/platsbanken/annonser/26673808,2022-10-17
10,"Drifttekniker, data",ELON Group AB,Infrastrukturspecialist till Elon Group,https://arbetsformedlingen.se/platsbanken/annonser/26652493,2022-10-12
11,Lagerarbetare,Insitepart AB,Jobba extra på Lager i Örebro,https://arbetsformedlingen.se/platsbanken/annonser/26725656,2022-10-28
12,Systemutvecklare/Programmerare,Cleverex Bemanning AB,Junior utvecklare till Enfo Code i Örebro ,https://arbetsformedlingen.se/platsbanken/annonser/26709994,2022-10-25
13,Lagerarbetare,Arbetskraften i Örebro AB,Lagerarbetare,https://arbetsformedlingen.se/platsbanken/annonser/26710867,2022-10-26
14,Lagerarbetare,Simplex Bemanning AB,Lagermedarbetare - Örebro - Heltid,https://arbetsformedlingen.se/platsbanken/annonser/26642687,2022-10-10
15,Truckförare,OnePartnerGroup Örebro AB,Lagermedarbetare sökes!,https://arbetsformedlingen.se/platsbanken/annonser/26716392,2022-10-27
16,Lagerarbetare,Miljonbemanning AB,Lagermedarbetare söks till storkund i Örebro!,https://arbetsformedlingen.se/platsbanken/annonser/26622549,2022-10-05
17,Lagerarbetare,Performiq AB,Lagermedarbetare till kund i Örebro,https://arbetsformedlingen.se/platsbanken/annonser/26706113,2022-10-25
18,Lagerarbetare,Lidl Sverige KB,Lagermedarbetare Örebro,https://arbetsformedlingen.se/platsbanken/annonser/26732362,2022-10-31
19,Lagerarbetare,Media-Saturn Nordic Shared Services AB,Ny kollega till vårt lager! 50-70%,https://arbetsformedlingen.se/platsbanken/annonser/26658650,2022-10-13
20,Lagerarbetare,Apoteket AB,Produktionsassistent på Apoteket Dos i Örebro,https://arbetsformedlingen.se/platsbanken/annonser/26683385,2022-10-19
21,Systemutvecklare/Programmerare,Transportstyrelsen,Senior systemutvecklare med intresse för helheten,https://arbetsformedlingen.se/platsbanken/annonser/26704940,2022-10-28
22,"Servicetekniker, data",Siemens AB,Servicetekniker Brand och säkerhet,https://arbetsformedlingen.se/platsbanken/annonser/26667904,2022-10-16
23,Systemutvecklare/Programmerare,Nexer AB,Skicklig systemutvecklare (.NET) till kund inom offentlig sektor i Örebro,https://arbetsformedlingen.se/platsbanken/annonser/26541092,2022-09-15
24,Lagerarbetare,Uniflex Sverige AB,Skjutstativsförare till vår kund i Örebro,https://arbetsformedlingen.se/platsbanken/annonser/26729454,2022-10-31
25,Lagerarbetare,Stoneridge Electronics AB,Stoneridge söker ytterligare medarbetare till både Produktion och Lager,https://arbetsformedlingen.se/platsbanken/annonser/26352339,2022-08-07
26,Lagerarbetare,Studentconsulting Sweden AB (Publ),Systembolagets depå söker fler till extrajobb!,https://arbetsformedlingen.se/platsbanken/annonser/26727031,2022-10-28
27,Systemutvecklare/Programmerare,Enfo Sweden AB,Systemutvecklare .NET och Azure,https://arbetsformedlingen.se/platsbanken/annonser/26528288,2022-09-13
28,Systemutvecklare/Programmerare,Envoke Talent AB,Systemutvecklare inom .NET till Alkemit i Örebro,https://arbetsformedlingen.se/platsbanken/annonser/26503196,2022-09-06
29,Systemutvecklare/Programmerare,Statistiska Centralbyrån,Systemutvecklare med inriktning mot SQL till SCB,https://arbetsformedlingen.se/platsbanken/annonser/26708110,2022-10-25
30,Truckförare,Nercia Bemanning AB,Truckförare Dagtid,https://arbetsformedlingen.se/platsbanken/annonser/26694065,2022-10-21
31,Truckförare,Industri Support Värmland AB,Truckförare till Maxidoor i Frövi,https://arbetsformedlingen.se/platsbanken/annonser/26707326,2022-10-25
32,Systemutvecklare/Programmerare,A Hub AB,Utvecklare? IT-Konsult? Se hit!,https://arbetsformedlingen.se/platsbanken/annonser/26754394,2022-11-04
33,IT-strateg,Örebro kommun,Verksamhetsutvecklare digitalisering till Bygglovsavdelningen,https://arbetsformedlingen.se/platsbanken/annonser/26739504,2022-11-01
