,occupation,organization,title,link
0,"Drifttekniker, data",Framtiden i Sverige AB,2nd line drifttekniker sökes till stort IT-konsult bolag!,https://arbetsformedlingen.se/platsbanken/annonser/26711453
1,Systemutvecklare/Programmerare,Experis AB,Bästa Utvecklare i Örebro,https://arbetsformedlingen.se/platsbanken/annonser/26222171
2,Lagerarbetare,Uniflex Sverige AB,Extrajobb Containerlossare,https://arbetsformedlingen.se/platsbanken/annonser/26676896
3,Lagerarbetare,Svenska Storesupport Bemanning AB,Extrajobb som lagermedarbetare på KGA Logistik - Örebro,https://arbetsformedlingen.se/platsbanken/annonser/26633844
4,IT-strateg,Försvarsmakten,IT specialist Microsoft Windows och mobilitet,https://arbetsformedlingen.se/platsbanken/annonser/26630919
5,IT-strateg,Randstad AB,IT-specialist inom datacenter och server till Örebro kommun,https://arbetsformedlingen.se/platsbanken/annonser/26717116
6,IT-tekniker/Datatekniker,REGION ÖREBRO LÄN,Infrastrukturspecialist inom Backup och Windows,https://arbetsformedlingen.se/platsbanken/annonser/26673808
7,"Drifttekniker, data",ELON Group AB,Infrastrukturspecialist till Elon Group,https://arbetsformedlingen.se/platsbanken/annonser/26652493
8,Lagerarbetare,Insitepart AB,Jobba extra på Lager i Örebro,https://arbetsformedlingen.se/platsbanken/annonser/26725656
9,Systemutvecklare/Programmerare,Cleverex Bemanning AB,Junior utvecklare till Enfo Code i Örebro ,https://arbetsformedlingen.se/platsbanken/annonser/26709994
10,Systemutvecklare/Programmerare,Alten Sverige AB,Juniora utvecklare som brinner för programmering ,https://arbetsformedlingen.se/platsbanken/annonser/26666555
11,Lagerarbetare,Arbetskraften i Örebro AB,Lagerarbetare,https://arbetsformedlingen.se/platsbanken/annonser/26710867
12,Lagerarbetare,Simplex Bemanning AB,Lagermedarbetare - Örebro - Heltid,https://arbetsformedlingen.se/platsbanken/annonser/26631307
13,Truckförare,OnePartnerGroup Örebro AB,Lagermedarbetare sökes!,https://arbetsformedlingen.se/platsbanken/annonser/26716392
14,Lagerarbetare,Miljonbemanning AB,Lagermedarbetare söks till storkund i Örebro!,https://arbetsformedlingen.se/platsbanken/annonser/26622549
15,Lagerarbetare,Performiq AB,Lagermedarbetare till kund i Örebro,https://arbetsformedlingen.se/platsbanken/annonser/26706113
16,Systemutvecklare/Programmerare,Academic Work Sweden AB,Mjukvaruutvecklare till AFRY sökes!,https://arbetsformedlingen.se/platsbanken/annonser/26618656
17,Lagerarbetare,Media-Saturn Nordic Shared Services AB,Ny kollega till vårt lager! 50-70%,https://arbetsformedlingen.se/platsbanken/annonser/26658650
18,Lagerarbetare,Apoteket AB,Produktionsassistent på Apoteket Dos i Örebro,https://arbetsformedlingen.se/platsbanken/annonser/26683385
19,Systemutvecklare/Programmerare,Transportstyrelsen,Senior systemutvecklare med intresse för helheten,https://arbetsformedlingen.se/platsbanken/annonser/26704940
20,"Servicetekniker, data",Siemens AB,Servicetekniker Brand och säkerhet,https://arbetsformedlingen.se/platsbanken/annonser/26667904
21,Systemutvecklare/Programmerare,Nexer AB,Skicklig systemutvecklare (.NET) till kund inom offentlig sektor i Örebro,https://arbetsformedlingen.se/platsbanken/annonser/26541092
22,Systemutvecklare/Programmerare,Textilia Tvätt & Textilservice AB,Specialist som tycker att data är det viktigaste som finns,https://arbetsformedlingen.se/platsbanken/annonser/26685587
23,Lagerarbetare,Stoneridge Electronics AB,Stoneridge söker ytterligare medarbetare till både Produktion och Lager,https://arbetsformedlingen.se/platsbanken/annonser/26352339
24,Lagerarbetare,Studentconsulting Sweden AB (Publ),Systembolagets depå söker fler till extrajobb!,https://arbetsformedlingen.se/platsbanken/annonser/26727031
25,Systemutvecklare/Programmerare,Enfo Sweden AB,Systemutvecklare .NET och Azure,https://arbetsformedlingen.se/platsbanken/annonser/26528288
26,Systemutvecklare/Programmerare,Envoke Talent AB,Systemutvecklare inom .NET till Alkemit i Örebro,https://arbetsformedlingen.se/platsbanken/annonser/26503196
27,Systemutvecklare/Programmerare,Statistiska Centralbyrån,Systemutvecklare med inriktning mot SQL till SCB,https://arbetsformedlingen.se/platsbanken/annonser/26708110
28,Truckförare,Nercia Bemanning AB,Truckförare Dagtid,https://arbetsformedlingen.se/platsbanken/annonser/26694065
29,Truckförare,Industri Support Värmland AB,Truckförare till Maxidoor i Frövi,https://arbetsformedlingen.se/platsbanken/annonser/26707326
30,Systemutvecklare/Programmerare,EVRY Sweden AB,Unpaid Internship IT/Tech - Tietoevry Örebro,https://arbetsformedlingen.se/platsbanken/annonser/26596374
31,IT-tekniker/Datatekniker,Visma Software AB,Visma EssCom söker servicetekniker i Örebro,https://arbetsformedlingen.se/platsbanken/annonser/26676866
